<?xml version="1.0" encoding="UTF-8"?>

<xs:schema xmlns:xs="http://www.w3.org/2001/XMLSchema" targetNamespace="http://www.swordsandsorcery.com/map"
           xmlns="http://www.swordsandsorcery.com/map" elementFormDefault="qualified">
    <xs:element name="map">
        <xs:complexType>
            <xs:all>
                <xs:element name="id" type="xs:unsignedInt" minOccurs="1"/>
                <xs:element name="main-shop" type="xs:unsignedInt" minOccurs="1"/>
                <xs:element name="spawn">
                    <xs:complexType>
                        <xs:all>
                            <xs:element name="timer" type="xs:unsignedInt" minOccurs="1"/>
                            <xs:element name="alive" type="xs:unsignedInt" minOccurs="1"/>
                            <xs:element name="spawns">
                                <xs:complexType>
                                    <xs:sequence>
                                        <xs:element name="monster" maxOccurs="unbounded">
                                            <xs:complexType>
                                                <xs:all>
                                                    <xs:element name="id" type="xs:unsignedInt" minOccurs="1"/>
                                                    <xs:element name="chance" type="xs:unsignedInt"/>
                                                    <xs:element name="spots" minOccurs="0">
                                                        <xs:complexType>
                                                            <xs:sequence>
                                                                <xs:element name="spot" minOccurs="1"
                                                                            maxOccurs="unbounded">
                                                                    <xs:complexType>
                                                                        <xs:attribute name="x" type="xs:positiveInteger"
                                                                                      use="required"/>
                                                                        <xs:attribute name="y" type="xs:positiveInteger"
                                                                                      use="required"/>
                                                                    </xs:complexType>
                                                                </xs:element>
                                                            </xs:sequence>
                                                        </xs:complexType>
                                                    </xs:element>
                                                </xs:all>
                                            </xs:complexType>
                                        </xs:element>
                                    </xs:sequence>
                                </xs:complexType>
                            </xs:element>
                        </xs:all>
                    </xs:complexType>
                </xs:element>
                <xs:element name="objects">
                    <xs:complexType>
                        <xs:sequence>
                            <xs:element name="object" maxOccurs="unbounded">
                                <xs:complexType>
                                    <xs:all>
                                        <xs:element name="name" type="xs:string" minOccurs="1"/>
                                        <xs:element name="type" minOccurs="1">
                                            <xs:simpleType>
                                                <xs:restriction base="xs:string">
                                                    <xs:enumeration value="TREE"/>
                                                </xs:restriction>
                                            </xs:simpleType>
                                        </xs:element>
                                    </xs:all>
                                    <xs:attribute name="x" type="xs:positiveInteger"
                                                  use="required"/>
                                    <xs:attribute name="y" type="xs:positiveInteger"
                                                  use="required"/>
                                </xs:complexType>
                            </xs:element>
                        </xs:sequence>
                    </xs:complexType>
                </xs:element>
            </xs:all>
        </xs:complexType>
    </xs:element>
</xs:schema>